type,post_message,post_published,likes_count_fb,comments_count_fb
link,Agnieszka Sady made Scotland her home ten years ago. She voted  No  in 2014  but would vote  Yes  today. Read her email to the SNP. #ScoEU,2016-07-01T15:47:59+0000,2376,1043
link,Scotland s place in Europe  Chilcot and WASPI: The SNP s Week In Westminster,2016-07-01T17:01:41+0000,835,240
photo,Thanks to members  supporters and friends who’ve translated Nicola’s message after the EU referendum result for those who’ve come from other countries and chosen Scotland as their home.  Access them here and share them with friends and family: https://drive.google.com/folderview?id=0B2WnZ6xbAgPuYXI0Tk1PLTlDb00&usp=sharing  And  if you’d like to provide a translation of Nicola’s message in another language  get in touch: http://www.snp.org/contact.,2016-07-01T17:53:38+0000,299,267
video,Nicola Sturgeon addresses formal opening of the 5th session of the Scottish Parliament:  We are one Scotland and home to all those who choose to live here. ,2016-07-02T10:56:23+0000,3856,1982
link,“It’s absolutely outrageous that a prospective prime minister is now using a Leave vote to imply that Scotland’s budget could be slashed – just months after the Tories agreed a new financial settlement for Scotland.”  - Michael Russell  convener of the Scottish Parliament Finance Committee,2016-07-02T13:07:28+0000,675,720
photo,Best wishes to everyone celebrating at Edinburgh #Pride2016 today.,2016-07-02T15:32:44+0000,783,233
link,Read just some of the promises made during the independence referendum by Tories and the No campaign that have now been broken.,2016-07-03T12:08:41+0000,1596,765
link,Agnieszka Sady  an EU resident in Scotland voted No in 2014 and now support s Scottish independence.   Read her powerful email to the SNP.,2016-07-04T11:21:09+0000,433,356
link,There are now five candidates to be Prime Minister and leader of the Tories.  From refusing to rule out the mass deportation of EU citizens  to raising the prospect of cuts to Scotland’s budget  here are some key facts about the candidates and what they stand for.,2016-07-04T16:31:20+0000,498,527
link,Today Nicola Sturgeon is meeting with business leaders to discuss Scotland s place in Europe  and hosting a representatives of EU countries to explore how the Scottish Government can provide further reassurance to all EU citizens living in Scotland.,2016-07-05T08:36:14+0000,979,319
link,Since the EU referendum  the SNP has taken steps to reassure people from other European countries living in Scotland that they remain welcome here and that we value their contribution.    Find out how.,2016-07-05T11:00:10+0000,1345,343
photo,Thanks to the hard work of our NHS staff  Scotland continues to have the best A&E performance in the UK.  http://news.scotland.gov.uk/News/A-E-performance-25f2.aspx,2016-07-05T16:10:53+0000,517,119
video,Scottish National Party (SNP) shared The Scottish Government s video.,2016-07-05T16:20:29+0000,827,245
photo, Scotland is your home.   Read Nicola Sturgeon s open letter to EU citizens living in Scotland.  http://www.gov.scot/Resource/0050/00502727.pdf,2016-07-05T17:05:29+0000,2388,589
photo,Thanks to members  supporters and friends who’ve translated Nicola’s message after the EU referendum result for those who’ve come from other countries and chosen Scotland as their home.  Access them here and share them with friends and family: https://drive.google.com/folderview?id=0B2WnZ6xbAgPuYXI0Tk1PLTlDb00&usp=sharing  And  if you’d like to provide a translation of Nicola’s message in another language  get in touch:http://www.snp.org/contact.,2016-07-05T18:00:28+0000,114,177
link,UPDATED: From prioritising Trident to scrapping workers’ rights –  here’s what you need to know about the Tory leadership candidates.,2016-07-05T20:00:13+0000,103,126
link,Scottish National Party (SNP) shared a link.,2016-07-06T09:11:01+0000,809,263
link,Scottish National Party (SNP) shared Nicola Sturgeon s post.,2016-07-06T10:53:41+0000,499,119
photo,Read the SNP statement on the #Chilcot report in full here: http://www.snp.org/snp_statement_on_the_chilcot_report,2016-07-06T10:55:12+0000,721,144
video, When will UK Governments - of either Tory or Labour hue - actually start learning from the mistakes of the past so we are not condemned to repeat them?”  Angus Robertson MP  SNP Westminster Leader responds to David Cameron’s statement on the Chilcot report of the Iraq Inquiry.,2016-07-06T12:37:48+0000,1106,161
video,“In our search for responsibility  wouldn’t it help if individuals responsible were held accountable?”  Alex Salmond MP  SNP International Affairs Spokesperson in Westminster  responds to David Cameron’s statement on the Chilcot report of the Iraq Inquiry.,2016-07-06T13:00:13+0000,1293,207
link,The long overdue and damning #Chilcot report on the Iraq invasion was published today. Here’s just some of what you need to know.,2016-07-06T17:56:28+0000,342,181
video,Scottish National Party (SNP) shared The National Newspaper s video.,2016-07-08T15:09:50+0000,833,250
link,Protecting EU residents  rights and the Chilcot Report: The SNP s Week in Westminster.,2016-07-08T16:45:36+0000,275,39
link,While the Scottish Government is working to secure Scotland’s place in Europe  it has not been distracted from the business of governing.  Scotland is leading the UK on house building and our A&E services have now been the best in the UK for over a year - just some good news from past weeks you may have missed. Read more here.,2016-07-09T12:06:41+0000,1965,704
link,There are now just two candidates to be leader of the Tories and the next Prime Minister.   From prioritising spending an eye-watering £205 billion on Trident to raising the prospect of cuts to Scotland’s budget  here are some key facts about the candidates and what they stand for.,2016-07-10T09:04:00+0000,200,160
link, It is  quite simply  a disgrace that the leading contender to replace David Cameron as Prime Minister has so far refused to guarantee the status of European nationals living here in the UK.   Nicola Sturgeon writes about reassuring the many EU nationals who have chosen to make Scotland their home.,2016-07-10T14:51:08+0000,2211,624
photo,Scottish National Party (SNP) shared Nicola Sturgeon s photo.,2016-07-10T16:18:15+0000,16819,985
link,A majority of the European public think that an independent Scotland should be welcomed into the EU.   Keep up to date here with what has happened since Scotland voted Remain in the EU referendum.,2016-07-11T10:58:05+0000,2519,667
link,The YouGov Euro Track poll interviewed 8 404 people in six EU countries and Norway – including 2 045 in Germany and 1 008 in France – and found support for an independent Scotland’s place in the EU from people in each country surveyed  including the UK.,2016-07-11T13:26:54+0000,2102,619
link,Who is Theresa May?  Go Home  vans  scrapping the Human Rights Act and prioritising Trident renewal.   Read more here.,2016-07-11T14:51:09+0000,695,872
photo,Finance Ministers from Scotland  Wales and Northern Ireland have written to Chancellor George Osborne seeking an urgent meeting to discuss concerns around the EU referendum result and the impact on devolved budgets. Find out more: http://news.scotland.gov.uk/News/Finance-ministers-meeting-265d.aspx,2016-07-11T18:57:04+0000,328,231
photo,A new poll has shown support for Scotland s place in the EU across the Continent.,2016-07-11T20:10:00+0000,1610,903
link,Ruth Davidson is talking about irresponsibility today. Here’s what her party did.,2016-07-12T13:45:19+0000,886,480
photo, For us remain means remain  - Nicola s message to Theresa May. Share if you agree.,2016-07-13T08:38:03+0000,5856,1316
video,Angus Robertson asks the Prime Minister how Theresa May s record will go down in Scotland. Read more: http://www.snp.org/who_is_theresa_may,2016-07-13T11:45:41+0000,1960,1218
photo,Over the next five years  a thousand new paramedics will be equipped with the skills and abilities to support people in their local communities. Find out more: http://news.scotland.gov.uk/News/1-000-new-paramedics-to-be-trained-2697.aspx,2016-07-13T12:17:01+0000,1732,346
photo,Theresa May s priorities are not Scotland s priorities. Find out more about what the new Prime Minister stands for. http://www.snp.org/who_is_theresa_may,2016-07-13T17:11:31+0000,755,850
photo,SNP MPs joined IC Change UK today to ratify the Istanbul Convention on violence against women. Find out more here: http://icchange.co.uk/,2016-07-13T19:05:00+0000,245,26
photo,Ahead of Monday s vote  SNP MPs today joined the Campaign for Nuclear Disarmament and Scottish CND to #StopTrident.,2016-07-13T19:45:00+0000,1025,230
video,Scottish National Party (SNP) shared Channel 4 News Democracy s video.,2016-07-13T21:05:09+0000,1580,815
link,The Standing Council on Europe  formed by Nicola Sturgeon to advise the Scottish Government on securing Scotland s EU status  meets for the first time today.,2016-07-14T11:08:44+0000,1759,775
photo,Today the new Chancellor  Philip Hammond  said he sees no prospect of Scotland agreeing its own continued status within the European Union. Here’s Nicola’s response. Share if you agree.  Find out more about what the Scottish Government is doing to protect Scotland’s place in Europe here: http://www.snp.org/taking_action_to_ensure_scotland_s_place_in_the_eu,2016-07-14T12:54:13+0000,1872,1180
link,Theresa May appointed Boris Johnson as the new foreign secretary. Here s how the world has reacted so far.,2016-07-14T14:44:20+0000,699,752
video,Nicola ahead of meeting the new Prime Minister  Theresa May  tomorrow.,2016-07-14T17:50:53+0000,534,670
link,Scottish National Party (SNP) shared Nicola Sturgeon s post.,2016-07-15T06:56:24+0000,2748,498
photo,Scotland’s universities are attracting a record number of applicants. Find out more here. http://news.scotland.gov.uk/News/Record-university-applicants-26f4.aspx,2016-07-15T10:43:23+0000,676,330
photo,Scottish National Party (SNP) shared Nicola Sturgeon s photo.,2016-07-15T15:23:33+0000,2042,820
link,Europe  Chilcot & Opposing Trident: The SNP s Week In Westminster.,2016-07-15T16:17:50+0000,246,143
video,Scottish National Party (SNP) shared Channel 4 News s video.,2016-07-15T17:49:06+0000,2555,701
link,From taking action to protect Scotland’s place in Europe to announcing 1 000 new paramedics for our NHS  here’s just some of what your SNP Scottish Government has done this week.,2016-07-16T11:18:07+0000,1034,755
link,Tomorrow Westminster votes on spending billions to replace Trident nuclear weapons. Here s what you need to know.,2016-07-17T09:00:00+0000,827,754
link, The SNP will always stand firm against nuclear weapons on the Clyde and will vote against its renewal tomorrow if it comes to that. But it needn’t.   Bill Kidd MSP calls on the new Prime Minister to delay the Trident vote scheduled for tomorrow.,2016-07-17T17:18:26+0000,266,339
link,The SNP Scottish Government will continue to explore all options to preserve our place in Europe. That’s what Scotland voted for. Find out more here.,2016-07-17T20:02:46+0000,1273,1129
photo,Estimates for Trident renewal range from £167bn to £205bn. At a time of enforced austerity  the SNP believes this money would be better invested in improved child care  education and the NHS. Find out more: http://www.snp.org/trident_what_you_need_to_know,2016-07-18T15:58:08+0000,1392,632
video,Tory Chair of the Commons Foreign Affairs Committee  Crispin Blunt  confirms the spiralling costs of Trident -  estimating a £179 billion price-tag before currency fluctuations.,2016-07-18T17:20:01+0000,780,701
video, Tories want a blank cheque for these useless weapons  and for what? To preserve Westminster s self-indulgent image of importance.    Mhairi Black MP opposing the UK government s desire to spend up to £205bn on Trident renewal.,2016-07-18T20:14:20+0000,6029,1273
photo,In a vote in the House of Commons tonight  58 of Scotland’s 59 MPs voted against Trident renewal. Only Scotland’s sole Tory MP voted for.   The UK government must respect Scotland’s clear decision against Trident renewal. Share if you agree.,2016-07-18T21:23:59+0000,5578,1968
link,Despite opposition of Scotland’s MPs  Westminster has voted to renew Trident - at a cost of up to £205bn.   If you agree that there is no justification for a new generation of nuclear weapons  sign the Stop Trident petition and share with your friends.,2016-07-18T21:26:48+0000,1360,1122
link,The SNP opposed it but Westminster voted to renew Trident.   Here s how it happened.,2016-07-19T10:16:01+0000,895,707
photo,The Scottish Government has announced a new ten year plan to protect homes in flood-prone communities. Read more here.  http://www.snp.org/pb_what_are_the_snp_doing_to_support_communities_affected_by_flooding,2016-07-19T12:00:00+0000,235,198
link,Scottish National Party (SNP) shared a link.,2016-07-19T16:28:37+0000,2528,1180
photo,Good news. Latest stats for March to May show employment up in Scotland. Find out more here: http://news.scotland.gov.uk/News/Increase-in-employment-levels-273a.aspx,2016-07-20T12:00:19+0000,502,294
link,The Scottish Government will introduce a new Child Poverty Bill to tackle deep-rooted causes of child poverty.,2016-07-20T13:15:09+0000,721,458
link,Today the First Minister announced that a new Child Poverty Bill will be introduced  adding to a range of actions the SNP is taking in government to tackle child poverty.   Read more here.,2016-07-20T19:00:01+0000,681,510
photo,Energy company Vattenfall has announced an investment of more than £300 million in the offshore wind project at Aberdeen Bay – keeping Scotland at the forefront of energy innovation.,2016-07-21T11:13:43+0000,1010,220
link,The SNP Scottish Government is working tirelessly to protect Scotland’s place in the EU. Since the referendum there has been strong support for this position from across Europe.  Get the facts here.,2016-07-21T14:13:36+0000,2557,1025
photo,The Minister for Further Education  Higher Education and Science  Shirley-Anne Somerville  today launched a joint statement with Universities Scotland reassuring EU nationals  including researchers  that they continue to be welcome at our universities following the EU referendum result.   Read more here: http://news.scotland.gov.uk/News/Research-excellence-in-Scotland-continues-2754.aspx,2016-07-21T16:03:12+0000,328,400
photo,SNP membership has reached a new record high of 120 203.   If you want to help us make Scotland all it can be  join us by going to www.JoinUs.scot,2016-07-22T12:00:01+0000,1736,694
photo,Today Nicola Sturgeon attended the British-Irish Council in Cardiff to discuss the outcome of the EU referendum and protecting Scotland’s place in Europe.   Read more about the action we’re taking to deliver what Scotland voted for – to stay in the EU: http://www.snp.org/taking_action_to_ensure_scotland_s_place_in_the_eu,2016-07-22T15:46:34+0000,1425,723
link,Opposing Trident and standing up for Scotland s place in Europe: The SNP s Week in Westminster. #ScrapTrident #ScoEU,2016-07-22T16:12:00+0000,899,599
link,From the renewal of Trident to the prospect to being taken out the EU against our will – Scotland’s democratic deficit has never been clearer.  Here are just five times that Scotland’s democratic decisions have been ignored by Westminster.,2016-07-24T09:00:00+0000,1227,1169
link,Watch Nicola Sturgeon make a speech on Scotland s future in the EU live from 11am today.,2016-07-25T08:33:44+0000,544,622
photo,In a major speech Nicola Sturgeon set out five key interests that depend on Scotland s relationship with the EU and must be protected. Read the speech here: http://www.snp.org/scotland_s_future_in_the_eu_speech_to_ippr_scotland,2016-07-25T11:42:21+0000,1084,898
link,Today Nicola Sturgeon set out Scotland’s five key EU interests that must be protected.   Here’s a quick summary.,2016-07-25T16:38:39+0000,1143,813
video,Scottish National Party (SNP) shared STV News s video.,2016-07-25T18:40:51+0000,1032,701
photo,£97.9m worth of grants have been given to nearly 204 000 households in Scotland. Find out more: http://news.scotland.gov.uk/News/Scottish-Welfare-Fund-2782.aspx,2016-07-26T12:34:09+0000,515,623
photo,Share if you agree: Scotland s vital interests in Europe must be protected.   Read more here: http://www.snp.org/scotland_s_5_key_eu_interests_that_must_be_protected,2016-07-27T09:26:23+0000,566,959
photo,The Scottish Government will clarify information provisions and implement what the UK Supreme Court has described as a  legitimate  policy.  Get the facts on the Supreme Court ruling on the failed bid to scrap Named Person here: http://www.snp.org/supreme_court_ruling_on_named_person_service_what_you_need_to_know,2016-07-28T10:55:27+0000,244,558
video,Scottish National Party (SNP) shared The Scottish Government s video.,2016-07-28T12:47:06+0000,358,1061
photo,The Scottish Government has launched a consultation on how to put dignity and respect at the heart of the new Scottish social security system.   Read more here: http://www.snp.org/pb_what_plans_do_the_snp_have_to_use_new_powers_around_social_security   Share your views here: https://consult.scotland.gov.uk/social-security/social-security-in-scotland,2016-07-29T13:01:33+0000,454,659
photo,Right to Buy ends tomorrow  meaning housing stock available for social renting will be protected into the future. Find out more: http://news.scotland.gov.uk/News/Right-to-buy-ends-in-Scotland-27ad.aspx,2016-07-30T11:06:33+0000,834,486
link,Today is World Day against Trafficking in Persons  a day to raise awareness of the situation facing victims of human trafficking and for the promotion and protection of their rights.   Read more about the action the SNP Scottish government is taking on the issue here.,2016-07-30T12:00:01+0000,285,367
photo,New figures show that Scotland has outperformed the UK and all but one EU-15 country  Sweden  in tackling climate change.   Get more information here: http://www.gov.scot/Resource/0050/00503688.pdf,2016-08-01T13:39:13+0000,1262,700
link,This week is  World Breastfeeding Week - an important initiative to help raise awareness of the benefits that breastfeeding can bring to people all over the planet.  Here’s what the SNP is doing to promote breastfeeding and support new mums and babies.,2016-08-02T11:03:18+0000,574,191
photo,A new £200 000 fund has been launched to encourage more disabled people in Scotland to stand for election.   Read more here: http://news.scotland.gov.uk/News/Fund-for-aspiring-politicians-27e5.aspx,2016-08-02T12:30:00+0000,489,208
photo,The UK Government still hasn’t explained what Brexit will mean.  To make things clearer  here’s a summary of the approaches taken by different countries outside of the EU.  http://www.snp.org/brexit_what_the_uk_government_hasn_t_explained,2016-08-02T19:00:21+0000,332,392
photo,Scotland’s hospital A&E performances have been the best in the UK for the last 15 months of published data.   Get more information here: http://news.scotland.gov.uk/News/Best-June-A-E-performance-since-2011-27e0.aspx,2016-08-03T11:00:00+0000,976,421
link,Scottish National Party (SNP) shared The Scottish Government s post.,2016-08-04T15:10:19+0000,489,910
photo,Scottish National Party (SNP) shared Nicola Sturgeon s photo.,2016-08-05T09:48:50+0000,2441,488
photo,The UK government still hasn t explained what Brexit means.   To make things clearer  here’s a summary of the approaches taken by different countries outside of the EU.  http://www.snp.org/brexit_what_the_uk_government_hasn_t_explained,2016-08-06T11:00:01+0000,267,578
link,Here are just ten ways that  in government  the SNP is working towards a Scotland that is fair and inclusive for all disabled people.,2016-08-07T11:00:00+0000,556,484
link,Today the SNP government launched a consultation on a Child Poverty Bill  adding to a range of actions it is taking to tackle child poverty.   You can give our view on the Bill here: https://consult.scotland.gov.uk/social-justice/consultation-on-a-child-poverty-bill-for-scotland     Read more about the action the SNP is taking in government to tackle the deep-rooted causes of poverty.,2016-08-08T12:44:53+0000,361,531
photo,It s exam results day today. If you have any questions about your results or your next steps  read more here: sqa.org.uk/results,2016-08-09T08:00:01+0000,1324,147
photo,Scottish National Party (SNP) shared John Swinney  MSP s photo.,2016-08-09T10:08:39+0000,1232,164
link,Scottish National Party (SNP) shared Nicola Sturgeon s post.,2016-08-09T11:51:01+0000,853,218
photo,Nicola Sturgeon has today met Germany’s Europe Minister  Michael Roth  in Berlin to discuss the EU referendum result and the next steps for the EU  UK and Scotland.   Read more: http://news.scotland.gov.uk/News/First-Minister-meets-German-government-286e.aspx,2016-08-09T14:41:37+0000,1605,1338
photo,Nicola Sturgeon has today announced a £100 million post-Brexit economic stimulus plan.   Read more here: http://www.snp.org/action_to_protect_scotland_economy_post_brexit,2016-08-10T10:50:39+0000,640,580
photo,The Scottish Government has created 100 new GP training places - meeting an SNP manifesto commitment.   Read more here: http://news.scotland.gov.uk/News/Drive-to-recruit-GP-trainees-2859.aspx,2016-08-10T13:50:23+0000,585,241
note,Scottish National Party (SNP) shared Nicola Sturgeon s note.,2016-08-10T16:57:00+0000,711,951
link,Here is some of what has been achieved in our health service since the election.,2016-08-13T11:00:01+0000,473,598
photo,We are working hard to improve educational standards across the country.,2016-08-14T11:00:11+0000,717,470
link,In government  the SNP has built twice as many schools as the previous administration.,2016-08-15T13:05:43+0000,902,209
link,Here s what the Tories aren t telling you about Scotland s EU funding.,2016-08-15T16:35:10+0000,546,590
photo,As the new school year begins  Nicola Sturgeon has announced funding for 46 primary schools to improve attainment.   Read more here: http://news.scotland.gov.uk/News/Focus-on-attainment-28c5.aspx,2016-08-16T16:00:01+0000,531,230
photo,Today the Scottish cabinet will hold a public Q&A on the EU referendum result for EU citizens.   Read more here: http://news.scotland.gov.uk/News/Celebrating-Scotland-s-diversity-28b2.aspx  You can also read the First Minister’s message to new Scots translated into several languages here: https://drive.google.com/drive/folders/0B2WnZ6xbAgPuYXI0Tk1PLTlDb00,2016-08-17T07:00:01+0000,306,294
video,Scottish National Party (SNP) shared The Scottish Government s live video.,2016-08-17T11:18:05+0000,234,242
photo,New figures show that employment in Scotland is up and unemployment is down.  Read more here: http://news.scotland.gov.uk/News/Increase-in-employment-levels-28d3.aspx,2016-08-17T13:00:01+0000,673,373
link,We re looking for a Senior Communications Officer based in the Scottish Parliament. If you want to join our team  apply before 29 August 2016.   More details here: http://www.snp.org/senior_communications_officer_snp_parliamentary_office,2016-08-17T16:03:32+0000,150,146
photo,The SNP Scottish government is taking steps to reassure EU citizens that live here that they remain welcome in Scotland.  Read more here: http://www.snp.org/scotland_is_your_home_our_action_to_reassure_eu_citizens,2016-08-17T19:00:00+0000,948,631
photo,We are committed to extending broadband coverage to every part of Scotland.   Read more about our ambitious digital connectivity plans here: http://www.snp.org/pb_how_are_the_snp_improving_scotland_s_digital_infrastructure,2016-08-18T12:00:00+0000,410,427
link,Today the First Minister s Council of Economic Advisers met to discuss the outcome of the EU referendum.  Here’s what action we’re taking to protect Scotland’s economy.,2016-08-18T16:00:00+0000,463,839
photo,Scottish National Party (SNP) shared Nicola Sturgeon s photo.,2016-08-19T11:34:42+0000,425,37
photo,Today Nicola Sturgeon launched the First Minister s Reading Challenge  which is designed to encourage children to read for pleasure and develop a life-long love of books.  Read all about it here: http://news.scotland.gov.uk/News/First-Minister-s-Reading-Challenge-kicks-off-2909.aspx,2016-08-19T13:13:27+0000,653,599
photo,Best wishes to everyone celebrating at Pride Glasgow today. Have a great time!,2016-08-20T11:00:01+0000,2908,745
link,With the Edinburgh festivals in full swing  here’s what we’re doing to support culture in Scotland.,2016-08-21T11:00:00+0000,327,484
link,The UK Government must now give a commitment to ensure that Scotland s universities do not lose out on vital support.,2016-08-22T13:31:17+0000,406,357
photo,Keeping #CalMac and carrying on!   Find out more: http://www.bbc.co.uk/news/uk-scotland-highlands-islands-37158463,2016-08-22T16:35:15+0000,774,128
link,The UK Justice Secretary has today confirmed that the Tory government remains committed to scrapping the Human Rights Act.  Here’s what you need to know about your rights and freedoms that are protected by the Act.,2016-08-22T19:59:56+0000,615,597
photo,What the Tories aren t telling you about #Brexit. Find out more: http://www.snp.org/brexit_what_the_uk_government_hasn_t_explained,2016-08-23T10:35:46+0000,346,469
link,New figures show that between January-March 2014 and January-March 2016  hospital mortality has fallen by 4.5%  3 000 fewer deaths.,2016-08-23T12:35:52+0000,390,91
video,“Whatever ‘Brexit means Brexit’ turns out to mean – the old argument that the UK delivers financial security no longer holds water.” - Nicola Sturgeon  Find out more: http://www.snp.org/brexit_what_the_uk_government_hasn_t_explained,2016-08-23T15:24:30+0000,1342,870
link,Scottish National Party (SNP) shared Nicola Sturgeon s post.,2016-08-23T16:04:53+0000,540,426
